{
  "schemaVersion": "research-object.v1",
  "id": "DC-008",
  "type": "DatasetContract",
  "title": "Gate 통과 외부표본 통합입력 데이터 계약",
  "version": "1.0.0",
  "lifecycleState": "proposed",
  "evidenceLevel": "conceptual",
  "purpose": "Gate를 통과한 독립 external OOF 출력과 protocol·run·evidence ID, calibration·불확실성·OOD·abstain, EXE 비용과 RSK 출력만 허용하는 통합입력 계약을 고정한다.",
  "dependsOn": [
    "DC-002",
    "RQ-008"
  ],
  "artifacts": [
    "research/meta-research/objects/dataset-contracts/DC-008-synthesis-inputs/data-contract.md"
  ]
}
