{
  "schemaVersion": "research-object.v1",
  "id": "DC-002",
  "type": "DatasetContract",
  "title": "프로그램 필수 입력군 데이터 계약",
  "version": "1.0.1",
  "lifecycleState": "completed",
  "evidenceLevel": "conceptual",
  "purpose": "GOAL-RP-001의 8개 필수 입력군에 대해 공개 기술 문서, 시점·단위·수정·계보 필드, 권리 한계와 현재 사용 가능범위를 보수적으로 고정한다.",
  "dependsOn": [
    "RQ-002"
  ],
  "artifacts": [
    "research/meta-research/objects/dataset-contracts/DC-002-program-data/data-contract.md",
    "research/meta-research/objects/dataset-contracts/DC-002-program-data/official-source-register.json"
  ]
}
