{
  "schemaVersion": "research-object.v1",
  "id": "DC-004",
  "type": "DatasetContract",
  "title": "PIT 상대가치·기업행동 데이터 계약",
  "version": "1.0.0",
  "lifecycleState": "proposed",
  "evidenceLevel": "conceptual",
  "purpose": "상대가치 연구의 PIT universe·membership·요인·기초자료·산업·금리·환율과 기업행동·상장폐지·vintage 계보의 수락조건을 고정한다.",
  "dependsOn": [
    "DC-002",
    "RQ-004"
  ],
  "artifacts": [
    "research/meta-research/objects/dataset-contracts/DC-004-relative-value/data-contract.md"
  ]
}

