{
  "schemaVersion": "research-object.v1",
  "id": "DC-007",
  "type": "DatasetContract",
  "title": "외부표본 신호·실행비용·위험예산 데이터 계약",
  "version": "1.0.0",
  "lifecycleState": "proposed",
  "evidenceLevel": "conceptual",
  "purpose": "외부 OOF BEH·VAL·MIC 출력, EXE 비용분포, 보유·통화·상관·stress·위험예산과 고정 위험선호 파라미터의 수락조건을 고정한다.",
  "dependsOn": [
    "DC-002",
    "RQ-007"
  ],
  "artifacts": [
    "research/meta-research/objects/dataset-contracts/DC-007-tail-risk/data-contract.md"
  ]
}
